root@lamp-ubuntu-s-1vcpu-1gb-tor1-01:~# tcpdump -n -i eth0
23:21:13.002944 IP 165.22.229.212.22 > 162.243.190.66.39464: Flags [P.], seq 2618064:2618288, ack 1, win 502, options [nop,nop,TS val 1835337676 ecr 3644652921], length 224
23:21:13.003017 IP 165.22.229.212.22 > 162.243.190.66.39464: Flags [P.], seq 2618288:2618496, ack 1, win 502, options [nop,nop,TS val 1835337676 ecr 3644652921], length 208
23:21:13.003170 IP 165.22.229.212.22 > 162.243.190.66.39464: Flags [P.], seq 2618496:2618896, ack 1, win 502, options [nop,nop,TS val 1835337676 ecr 3644652921], length 400
23:21:13.003299 IP 165.22.229.212.22 > 162.243.190.66.39464: Flags [P.], seq 2618896:2619120, ack 1, win 502, options [nop,nop,TS val 1835337676 ecr 3644652921], length 224
23:21:13.003426 IP 165.22.229.212.22 > 162.243.190.66.39464: Flags [P.], seq 2619120:2619344, ack 1, win 502, options [nop,nop,TS val 1835337676 ecr 3644652921], length 224
23:21:13.003552 IP 165.22.229.212.22 > 162.243.190.66.39464: Flags [P.], seq 2619344:2619568, ack 1, win 502, options [nop,nop,TS val 1835337676 ecr 3644652921], length 224
23:21:13.003748 IP 162.243.190.66.39464 > 165.22.229.212.22: Flags [.], ack 2619568, win 9011, options [nop,nop,TS val 3644652922 ecr 1835337676], length 0
23:21:13.003768 IP 165.22.229.212.22 > 162.243.190.66.39464: Flags [P.], seq 2619568:2619792, ack 1, win 502, options [nop,nop,TS val 1835337676 ecr 3644652921], length 224
23:21:13.003939 IP 165.22.229.212.22 > 162.243.190.66.39464: Flags [P.], seq 2619792:2620176, ack 1, win 502, options [nop,nop,TS val 1835337677 ecr 3644652922], length 384
23:21:13.004079 IP 165.22.229.212.22 > 162.243.190.66.39464: Flags [P.], seq 2620176:2620400, ack 1, win 502, options [nop,nop,TS val 1835337677 ecr 3644652922], length 224
23:21:13.004206 IP 165.22.229.212.22 > 162.243.190.66.39464: Flags [P.], seq 2620400:2620624, ack 1, win 502, options [nop,nop,TS val 1835337677 ecr 3644652922], length 224
23:21:13.004335 IP 165.22.229.212.22 > 162.243.190.66.39464: Flags [P.], seq 2620624:2620848, ack 1, win 502, options [nop,nop,TS val 1835337677 ecr 3644652922], length 224
23:21:13.004472 IP 165.22.229.212.22 > 162.243.190.66.39464: Flags [P.], seq 2620848:2621072, ack 1, win 502, options [nop,nop,TS val 1835337677 ecr 3644652922], length 224
23:21:13.004597 IP 165.22.229.212.22 > 162.243.190.66.39464: Flags [P.], seq 2621072:2621296, ack 1, win 502, options [nop,nop,TS val 1835337677 ecr 3644652922], length 224
23:21:13.004721 IP 165.22.229.212.22 > 162.243.190.66.39464: Flags [P.], seq 2621296:2621520, ack 1, win 502, options [nop,nop,TS val 1835337677 ecr 3644652922], length 224
23:21:13.004933 IP 162.243.190.66.39464 > 165.22.229.212.22: Flags [.], ack 2621072, win 9011, options [nop,nop,TS val 3644652923 ecr 1835337676], length 0
23:21:13.004962 IP 165.22.229.212.22 > 162.243.190.66.39464: Flags [P.], seq 2621520:2621744, ack 1, win 502, options [nop,nop,TS val 1835337678 ecr 3644652923], length 224
23:21:13.005146 IP 165.22.229.212.22 > 162.243.190.66.39464: Flags [P.], seq 2621744:2622128, ack 1, win 502, options [nop,nop,TS val 1835337678 ecr 3644652923], length 384
23:21:13.005278 IP 165.22.229.212.22 > 162.243.190.66.39464: Flags [P.], seq 2622128:2622352, ack 1, win 502, options [nop,nop,TS val 1835337678 ecr 3644652923], length 224
23:21:13.005419 IP 165.22.229.212.22 > 162.243.190.66.39464: Flags [P.], seq 2622352:2622576, ack 1, win 502, options [nop,nop,TS val 1835337678 ecr 3644652923], length 224
23:21:13.005554 IP 165.22.229.212.22 > 162.243.190.66.39464: Flags [P.], seq 2622576:2622800, ack 1, win 502, options [nop,nop,TS val 1835337678 ecr 3644652923], length 224
23:21:13.005623 IP 162.243.190.66.39464 > 165.22.229.212.22: Flags [.], ack 2622576, win 9011, options [nop,nop,TS val 3644652924 ecr 1835337677], length 0
23:21:13.005740 IP 165.22.229.212.22 > 162.243.190.66.39464: Flags [P.], seq 2622800:2623120, ack 1, win 502, options [nop,nop,TS val 1835337678 ecr 3644652924], length 320
23:21:13.019324 IP 165.22.229.212.22 > 162.243.190.66.39464: Flags [P.], seq 2622800:2623120, ack 1, win 502, options [nop,nop,TS val 1835337692 ecr 3644652924], length 320
23:21:13.019666 IP 162.243.190.66.39464 > 165.22.229.212.22: Flags [.], ack 2623120, win 9011, options [nop,nop,TS val 3644652938 ecr 1835337678,nop,nop,sack 1 {2622800:2623120}], length 0
23:21:13.025186 IP 162.243.190.66.39464 > 165.22.229.212.22: Flags [P.], seq 1:33, ack 2623120, win 9011, options [nop,nop,TS val 3644652943 ecr 1835337678], length 32
23:21:13.025186 IP 162.243.190.66.39464 > 165.22.229.212.22: Flags [P.], seq 33:65, ack 2623120, win 9011, options [nop,nop,TS val 3644652943 ecr 1835337678], length 32
^C
12258 packets captured
12261 packets received by filter
0 packets dropped by kernel