root@lamp-ubuntu-s-1vcpu-1gb-tor1-01:~# tcpdump -c 5 -i eth0
tcpdump: verbose output suppressed, use -v or -vv for full protocol decode
listening on eth0, link-type EN10MB (Ethernet), capture size 262144 bytes
23:14:41.969200 IP lamp-ubuntu-s-1vcpu-1gb-tor1-01.ssh > 162.243.190.66.39464: Flags [P.], seq 2440991689:2440991817, ack 2043720746, win 502, options [nop,nop,TS val 1834946642 ecr 3644261877], length 128
23:14:41.969324 IP lamp-ubuntu-s-1vcpu-1gb-tor1-01.ssh > 162.243.190.66.39464: Flags [P.], seq 128:320, ack 1, win 502, options [nop,nop,TS val 1834946642 ecr 3644261877], length 192
23:14:41.969602 IP lamp-ubuntu-s-1vcpu-1gb-tor1-01.ssh > 162.243.190.66.39464: Flags [P.], seq 320:384, ack 1, win 502, options [nop,nop,TS val 1834946642 ecr 3644261877], length 64
23:14:41.969789 IP 162.243.190.66.39464 > lamp-ubuntu-s-1vcpu-1gb-tor1-01.ssh: Flags [.], ack 128, win 9011, options [nop,nop,TS val 3644261888 ecr 1834946642], length 0
23:14:41.969789 IP 162.243.190.66.39464 > lamp-ubuntu-s-1vcpu-1gb-tor1-01.ssh: Flags [.], ack 320, win 9011, options [nop,nop,TS val 3644261888 ecr 1834946642], length 0
5 packets captured
49 packets received by filter
13 packets dropped by kernel